,categories,location,name,rating,review_count,snippet_text,yelp_id
228,"[Category(name='Sports Bars', alias='sportsbars'), Category(name='American (New)', alias='newamerican'), Category(name='Lounges', alias='lounges')]","(40.7526130492966, -73.9848813489212)",Proper West,4.0,211,"Best meal dinner or lunch near Times Square. Reasonably priced, CLEAN, good service and comfortable ambience. 
The last four qualities are HARD to get...",proper-west-new-york
229,"[Category(name='Lounges', alias='lounges')]","(40.727064, -73.983786)",Please Don't Tell,4.0,1375,"Surprise date prepared by the hubby. From hearing about how he was finally able to score a reservation, I'm still baffled that he actually got it. They...",please-dont-tell-new-york-2
230,"[Category(name='Lounges', alias='lounges')]","(40.76438, -73.97968)",The Carnegie Club,4.0,163,"A true gentleman's club. And I mean that strictly in the complete opposite conceptualization of an actual gentleman's club.

The Carnegie Club is one of the...",the-carnegie-club-new-york-2
231,"[Category(name='American (Traditional)', alias='tradamerican'), Category(name='Bars', alias='bars')]","(40.7588826206853, -73.9532321772766)",Riverwalk Bar & Grill,3.5,158,This great gem on Roosevelt Island is a short walk from the tram. The service is prompt and friendly and the food is great. We were walking around so we...,riverwalk-bar-and-grill-roosevelt-island
232,"[Category(name='Pubs', alias='pubs')]","(40.78102, -73.94909)",Biddy's Pub,4.0,75,"I showed up at 5 with some friends on a Sunday. It was empty except for two regulars and the bartender. Drinks were a good, we got happy hour prices, and we...",biddys-pub-new-york
233,"[Category(name='Cocktail Bars', alias='cocktailbars'), Category(name='Venues & Event Spaces', alias='venues')]","(40.747261, -73.986351)",Cloud Social Rooftop Bar,3.5,154,I have been here multiple times and had a great time each time. Last time I came here was a Wednesday after work. The wait for the elevator can be quite...,cloud-social-rooftop-bar-new-york
234,"[Category(name='Pubs', alias='pubs'), Category(name='American (Traditional)', alias='tradamerican')]","(40.763156, -73.996253)",Landmark Tavern,4.0,185,This has been a bookmarked spot for awhile. I finally came. We were volunteering at a big walk at the Intrepid and had been standing in the sun for 7 hours...,landmark-tavern-new-york-2
235,"[Category(name='Bars', alias='bars'), Category(name='American (New)', alias='newamerican')]","(40.7059604, -74.0041871)",Trading Post,4.0,211,Came her for mothers days brunch. We were 15 minutes late to our reservation but they sat us anyway in a corner nook by a window. Super intimate and cozy....,trading-post-new-york
236,"[Category(name='Bars', alias='bars')]","(40.72758, -73.99056)",Scratcher,4.0,116,"It's a good dark little bar.  Music is low, noise level is just right.  This is definitely a good bar to meet your friend for a drink & chat.",scratcher-new-york
237,"[Category(name='Jazz & Blues', alias='jazzandblues'), Category(name='Bars', alias='bars')]","(40.73378, -74.00224)",The 55 Bar,4.0,129,"Wanna feel like you are in 1965 and watching Miles play some sick jazz? Come here. The ceiling tiles and everything else haven't changed since then, 'nor...",the-55-bar-new-york
238,"[Category(name='Japanese', alias='japanese'), Category(name='Coffee & Tea', alias='coffee'), Category(name='Bars', alias='bars')]","(40.7292175292969, -73.9860382080078)",Hi-Collar,4.5,212,"~ One of the best coffees in new York. 
~ Limited seating. 
~ Japanese bathroom. 
~ Cafe at daytime, sake bar at night. 
~ Their night menu is my favorite....",hi-collar-new-york-2
239,"[Category(name='Lounges', alias='lounges'), Category(name='Cocktail Bars', alias='cocktailbars')]","(40.8022697271481, -73.9567852020264)",67 Orange Street,4.0,276,"What a great find!  My friends and I came here after dinner one Saturday night.  The staff was really welcoming and the cocktails were very inventive.

The...",67-orange-street-new-york
240,"[Category(name='Bars', alias='bars'), Category(name='Seafood', alias='seafood'), Category(name='American (New)', alias='newamerican')]","(40.7202418171989, -74.0160311904907)",Grand Banks,4.0,171,Wow...amazing is all I have to say about this place. What a wonderful idea to have drinks on a docked boat overlooking the beautiful FiDi skyline! The boat...,grand-banks-manhattan
241,"[Category(name='Pubs', alias='pubs'), Category(name='British', alias='british')]","(40.7506062, -73.9801755)",The Shakespeare,4.0,214,"Shakespeare is one of two pubs that carry Fullers London Pride on tap in NYC, don't leave without trying this pale beaut'. They have other British classics...",the-shakespeare-new-york
242,"[Category(name='Cocktail Bars', alias='cocktailbars')]","(40.7423425671777, -73.9832636341453)",Roof at Park South,3.5,97,Got in here with no wait on a Wednesday evening. The bouncers and the hostess seemed quite chill. The crowd is pretty laid back here but maybe because we...,roof-at-park-south-new-york
243,"[Category(name='American (New)', alias='newamerican'), Category(name='Cocktail Bars', alias='cocktailbars')]","(40.72395, -73.99391)",The Musket Room,4.5,233,Just ... yes. Epic? Brilliant? Perfect? How many superlatives can I use before it seems like I'm being paid to write this? I'm trying to think of having had...,the-musket-room-new-york
244,"[Category(name='Cocktail Bars', alias='cocktailbars')]","(40.72719, -73.99999)",Lumos Bar,4.5,47,"One sip here and it brings me back to the family dinners in China when the adults are getting red-faced wasted off this high proof Chinese spirit. 

Bai Jiu...",lumos-bar-new-york
245,"[Category(name='Cocktail Bars', alias='cocktailbars')]","(40.72296, -73.98936)",Aeté Rooftop,5.0,6,"I'm hesitant to leave a good review because I don't want people discovering my new favorite rooftop bar in New York. The bartenders are SUPER nice as well,...",aeté-rooftop-new-york
246,"[Category(name='Cocktail Bars', alias='cocktailbars')]","(40.722401, -73.992149)",Bonnie Vee,4.0,78,"I won't lie, every time I go here I want to hate it, but I end up having a great time. As a local, going out on the weekend is generally annoying but the...",bonnie-vee-new-york
247,"[Category(name='Cocktail Bars', alias='cocktailbars')]","(40.7271041, -73.9797561)",Dream Baby,4.0,72,"We had our wedding party celebration here on 6/24. To say they were great is the understatement of the century. 

The room was beautiful. The drinks were...",dream-baby-new-york-2
248,"[Category(name='Tapas Bars', alias='tapas'), Category(name='Wine Bars', alias='wine_bars'), Category(name='Modern European', alias='modern_european')]","(40.767137, -73.9866739)",Kilo,4.0,296,"I don't often post reviews but this place is over the top. I'm writing this review as I just finished eating the mushroom taco. OMG: What a delight! 
The...",kilo-new-york
249,"[Category(name='Sports Bars', alias='sportsbars'), Category(name='Chicken Wings', alias='chicken_wings'), Category(name='Sandwiches', alias='sandwiches')]","(40.760715, -73.995086)",Lansdowne Road,4.0,332,"Came here to watch a game on TV. When we looked around, we saw a tv for EVERY SINGLE GAME GOING ON. Seriously, every baseball team was playing.

We plopped...",lansdowne-road-new-york-2
250,"[Category(name='Lounges', alias='lounges'), Category(name='Cocktail Bars', alias='cocktailbars')]","(40.7290115356445, -73.9780197143555)",Pouring Ribbons,4.0,286,"Pouring ribbons is one of those places that you wont find unless you are looking for it. I almost missed the door!

Pouring ribbons is a proper bar. With...",pouring-ribbons-new-york
251,"[Category(name='Gastropubs', alias='gastropubs'), Category(name='Bars', alias='bars'), Category(name='American (New)', alias='newamerican')]","(40.742702, -74.000778)",Cooper's Craft & Kitchen,4.0,180,Great value for lunch $13 ( sandwich combo Fries or Beer or salad ) but there was only one waiter for all ppl and looked so hectic for lunch time even...,coopers-craft-and-kitchen-new-york-2
252,"[Category(name='Cocktail Bars', alias='cocktailbars'), Category(name='Restaurants', alias='restaurants')]","(40.7508871, -74.0041249)",Gallow Green,3.5,426,Had a lovely evening here with a friend on a Tuesday. Be prepared to spend a lot on drinks (and food) but I do think the stellar view is baked into those...,gallow-green-new-york
253,"[Category(name='Bars', alias='bars')]","(40.722663, -73.986328)",Drexler's,4.5,35,"Drexler's is a great place to go for happy hour with friends when you don't want to spend your entire paycheck, but don't want to drink absolute bottom...",drexlers-new-york
254,"[Category(name='Bars', alias='bars')]","(40.724617, -73.993156)",Tom & Jerry's,4.0,215,"Our friends from the Bowery treated us to the little spot AKA the 288.  Cozy confines, great drinks, and a solid juke box.

What else could you ask for in a...",tom-and-jerrys-new-york
255,"[Category(name='Lounges', alias='lounges'), Category(name='American (New)', alias='newamerican')]","(40.731319, -74.000663)",Vol de Nuit,4.0,449,"I love the hole-in-the-wall feel of this Belgian beer bar in NYC. Blink and you'll miss it! 

Vol de Nuit has a wide (but somewhat expensive) selection of...",vol-de-nuit-new-york
256,"[Category(name='Karaoke', alias='karaoke'), Category(name='Lounges', alias='lounges')]","(40.7197504957621, -73.999181630097)",Baby Grand,4.0,153,"Love! It's not too crowded during a week day. Each song is $2 and the bartender will try to switch ppl to go up and sing. It's super small and the ""stage""...",baby-grand-new-york
257,"[Category(name='Wine Bars', alias='wine_bars'), Category(name='African', alias='african'), Category(name='Tapas Bars', alias='tapas')]","(40.7819, -73.95197)",Kaia Wine Bar,4.0,256,"Rating: Outperform
Price Target: $40

The only reason for disappointment in Kaia (RAND) was our initial thought that everything was priced in the South...",kaia-wine-bar-new-york
258,"[Category(name='Wine Bars', alias='wine_bars'), Category(name='Gastropubs', alias='gastropubs')]","(40.72692, -73.98342)",Ten Degrees Bar,4.0,711,"Review is solely based on their Happy Hour.

Stumbled into here with some friends to get some drinks. Place is very dark with overall vibes being loud but...",ten-degrees-bar-new-york
259,"[Category(name='Bars', alias='bars'), Category(name='Cafes', alias='cafes')]","(40.7290935, -73.9785323)",The Roost,4.5,80,"Tucked away in the East Village, this cafe-bar has everything you could ever want and more. I feel like I shouldn't share this review, just so I can keep it...",the-roost-new-york
260,"[Category(name='Bars', alias='bars')]","(40.771961874462, -73.9582443237305)",Bar Pleiades,4.5,59,"This bar is straight up sexy af

It is dark in the right way. 

I am a martini or near scotch guy so it is hard for me to comment on their cocktail list,...",bar-pleiades-new-york
261,"[Category(name='Mediterranean', alias='mediterranean'), Category(name='Cocktail Bars', alias='cocktailbars'), Category(name='Venues & Event Spaces', alias='venues')]","(40.737398, -74.00796)",Entwine,4.0,146,"This place is absolutely adorable, cozy and one of the greatest long-term NYC establishments. 

Set up shop with your small group on their back patio. Enjoy...",entwine-new-york
262,"[Category(name='American (New)', alias='newamerican'), Category(name='Butcher', alias='butcher'), Category(name='Beer Bar', alias='beerbar')]","(40.74378, -73.982649)",The Cannibal,4.0,360,Cannibal is a solid choice for meat and cheese. We walked in early on a Friday night and was able to snag two seats in front of the prep counter. A bit...,the-cannibal-new-york
263,"[Category(name='American (Traditional)', alias='tradamerican'), Category(name='Gastropubs', alias='gastropubs'), Category(name='Bars', alias='bars')]","(40.864894, -73.927665)",Tryon Public House,4.0,179,"Tryon Public House is a bar/ restaurant close to Cloisters museum. Take the A train to Dyckman Street and its across the street. 

We had gone to the...",tryon-public-house-new-york
264,"[Category(name='Bars', alias='bars'), Category(name='Tex-Mex', alias='tex-mex'), Category(name='Cajun/Creole', alias='cajun')]","(40.7622760428535, -73.9599502086639)",Honky Tonk Tavern,3.5,125,This is a great local bar. Food is good and booze is cheap!! Their frozen margaritas are also amazing and only 5$!!!,honky-tonk-tavern-new-york
265,"[Category(name='Belgian', alias='belgian'), Category(name='Bars', alias='bars')]","(40.78875, -73.9746399)",B. Cafe West,4.0,246,"Enjoyed a delicious brunch here over Memorial Day weekend. I have had B Cafe on my list of places to try, and finally did! 

They have outdoor seating, and...",b-cafe-west-new-york
266,"[Category(name='Bars', alias='bars'), Category(name='Gastropubs', alias='gastropubs'), Category(name='American (New)', alias='newamerican')]","(40.727409362793, -73.9881591796875)",Lionsbeerstore,4.5,50,"Love this place. The selection of beers is crazy huge. My husband wants this set-up in our basement.

The fries are delicious.... my type of fry... hand cut...",lionsbeerstore-new-york-2
267,"[Category(name='Bars', alias='bars'), Category(name='Gastropubs', alias='gastropubs')]","(40.72957, -73.98719)",The Copper Still,4.0,86,A wasp stings you... OUCH! You're startled... you are discombobulated... you are downright DISMAYED! Do you cry? Perhaps you scream... MAYHAPS you call your...,the-copper-still-new-york
268,"[Category(name='Cocktail Bars', alias='cocktailbars'), Category(name='Jazz & Blues', alias='jazzandblues'), Category(name='Lounges', alias='lounges')]","(40.732688, -73.997467)",Analogue,4.0,155,Came here with a friend on a Friday night. Really great ambiance and classy place. I was hoping to get some live jazz or blues and although it didn't...,analogue-new-york
269,"[Category(name='Bars', alias='bars')]","(40.7390480041504, -74.001594543457)",Wood and Ales,4.0,105,"Stopped in for a couple of drinks before our dinner reservation next door.  Great prices (for NYC), good service, fun atmosphere!  Would definitely return.",wood-and-ales-new-york-2
270,"[Category(name='Irish', alias='irish'), Category(name='Pubs', alias='pubs')]","(40.737661, -73.991113)",Lillie's Victorian Bar & Restaurant,4.0,829,We picked this place based on its description (we were taking a friend to New York one last time before she moved back to Texas and she's a huge fan of...,lillies-victorian-bar-and-restaurant-new-york
271,"[Category(name='Sports Bars', alias='sportsbars'), Category(name='Pubs', alias='pubs')]","(40.7379684, -73.9841309)",Gramercy Ale House,4.5,29,"Ordered a bunch of appetizers, nicest around! Everything was so good! Great service, great drinks! Martin and Trevor are the best bartenders! I wish I could...",gramercy-ale-house-new-york
272,"[Category(name='Cuban', alias='cuban'), Category(name='Cocktail Bars', alias='cocktailbars'), Category(name='Breakfast & Brunch', alias='breakfast_brunch')]","(40.752155, -73.984223)",Calle Dao,4.0,400,"Bottomless brunch here is awesome! 

Atmosphere is simply Devine! Highly recommend the angus burger.

The only place I've found in midtown that have more...",calle-dao-new-york
273,"[Category(name='Sports Bars', alias='sportsbars'), Category(name='Pubs', alias='pubs')]","(40.7423425465822, -73.9835368841887)",Turnmill,4.0,108,"Great sports bar!
Awesome beer selection and very good happy hour specials (discounts on wine, house mixed drinks, and domestic beer).
We came on a Thursday...",turnmill-new-york
274,"[Category(name='Tapas Bars', alias='tapas'), Category(name='Breakfast & Brunch', alias='breakfast_brunch'), Category(name='Wine Bars', alias='wine_bars')]","(40.7728412, -73.9558687)",Pil Pil,4.0,306,"Uhm, this brunch got me drunk and delivered a headache to kill for the next morning. Thanks sunday friends.

Only thing better would have been to be outside.",pil-pil-new-york
275,"[Category(name='Cocktail Bars', alias='cocktailbars'), Category(name='Mediterranean', alias='mediterranean')]","(40.7462, -73.9774599)",Ted's Corner Tavern,4.5,72,"Teds is a beautiful little bar in Murray Hills. 

I bin here before for dollar oysters, and after work drink. When I had happy hour dollar oysters for first...",teds-corner-tavern-new-york
276,"[Category(name='Dive Bars', alias='divebars')]","(40.715394, -73.990103)",Clockwork Bar,4.0,31,"To put it short: Clockwork kicks ass. No nonsense (and awesome) bartenders, cheap beers, good music, free popcorn. If you're looking for some trendy LES bar...",clockwork-bar-new-york
277,"[Category(name='American (New)', alias='newamerican'), Category(name='Bars', alias='bars'), Category(name='Breakfast & Brunch', alias='breakfast_brunch')]","(40.72572, -74.00798)",Union Bar & Kitchen,4.5,112,"Highly recommend: creative menu, friendly, attentive service staff, delicious offerings.

On a Thursday evening, just last night, I had the pleasure of...",union-bar-and-kitchen-new-york
278,"[Category(name='Lounges', alias='lounges'), Category(name='French', alias='french')]","(40.761421, -73.977761)",The Modern - Bar Room,4.0,403,EPIC.  Phenomenal staff. Josh (sommelier) was superb.  Excellent combination of wonderful personality and exceptional knowledge.  Steve (our waiter) was on...,the-modern-bar-room-new-york
279,"[Category(name='Bars', alias='bars')]","(40.7203941345215, -73.9879302978516)",Local 138,4.0,212,"Great Happy Hour Specials.

$3 drafts? I mean sure they are select drafts but right in the fun zone of L.E.S. is hard to beat. Yes, this is a dive bar but...",local-138-new-york
280,"[Category(name='Bars', alias='bars'), Category(name='American (Traditional)', alias='tradamerican')]","(40.7856357379371, -73.9843865064108)",Boat Basin Café,3.5,533,"This is a nice spot to just unwind and have some drinks.

It's outdoor space where you can get a nice view of the sunset. The drinks are not too expensive...",boat-basin-café-new-york-2
281,"[Category(name='Tapas/Small Plates', alias='tapasmallplates'), Category(name='Lounges', alias='lounges')]","(40.720079, -73.987785)",Verlaine,4.0,1157,"$6 happy hour from 6-10!!! What an amazing deal! Their drinks were quite strong, but really tasty. The hostess was also very kind and helpful. I would...",verlaine-new-york-2
282,"[Category(name='Hotels', alias='hotels'), Category(name='Bars', alias='bars')]","(40.7455725822204, -73.9882193498224)",Ace Hotel New York,4.0,582,"Despite having family and friends in New York to stay at, my bf and I opted to stay the weekend at this hotel to experience what all the hype was about....",ace-hotel-new-york-new-york-2
283,"[Category(name='Pubs', alias='pubs')]","(40.77526, -73.947967)",Bailey's Corner Pub,4.0,57,"Bailey's has always been my favorite neighborhood bar, in a neighborhood *packed* with great bars. The staff is stellar, they'll make you feel welcome the...",baileys-corner-pub-new-york
284,"[Category(name='Ethiopian', alias='ethiopian'), Category(name='Bars', alias='bars')]","(40.7370922, -74.0051453)",Injera,4.5,274,"Injera is a revelation - best Ethiopian in the city.  This tiny, typical-for-Greenwich Village restaurant packs not just good atmosphere and good food, but...",injera-new-york
285,"[Category(name='American (New)', alias='newamerican'), Category(name='Lounges', alias='lounges'), Category(name='Wine Bars', alias='wine_bars')]","(40.720073, -74.007227)",Brandy Library,4.0,445,"Pure sophistication. When you want to spend time with someone in conversation over a glass of something, without the noise level - this is where you go. The...",brandy-library-new-york
286,"[Category(name='Pubs', alias='pubs'), Category(name='Burgers', alias='burgers')]","(40.703723, -74.012374)",White Horse Tavern - Financial District,4.0,188,"I've only been here twice, each time following a flight from out-of-state, but it was a nice pit-stop both times. Although I was a traveler who meandered...",white-horse-tavern-financial-district-new-york
287,"[Category(name='Bars', alias='bars'), Category(name='Belgian', alias='belgian')]","(40.770812, -73.957664)",B Cafe East,4.0,325,Overall: Hidden gem in the Upper East Side that has yet to disappoint me. I have only gone for brunch and have had the egg sandwich both times. Although...,b-cafe-east-new-york
288,"[Category(name='Thai', alias='thai'), Category(name='Bars', alias='bars')]","(40.758697, -73.992064)",At nine Restaurant & Bar,4.0,249,"I've ordered delivery from here several more times. Every time I don't get the Kow Soi (Northern Thai Curry Noodle Soup), my gf does and I end up being...",at-nine-restaurant-and-bar-new-york
289,"[Category(name='Bars', alias='bars'), Category(name='American (New)', alias='newamerican'), Category(name='Music Venues', alias='musicvenues')]","(40.71951, -74.00413)",Belle Reve,4.0,61,French onion soup and broiled mac n' cheese is hidden on their lunch menu!!! This place gets bust towards 12:30 but if you can get here at noon its very...,belle-reve-new-york
290,"[Category(name='American (New)', alias='newamerican'), Category(name='Bars', alias='bars')]","(40.734186, -73.993696)",Gotham Bar and Grill,4.5,1210,"There is little I can add to the many other compliments Gotham has gotten from Yelp reviewers.

Let me just say that I have eaten at Gotham a good number of...",gotham-bar-and-grill-new-york
291,"[Category(name='Dive Bars', alias='divebars'), Category(name='Lounges', alias='lounges')]","(40.7270798946679, -73.9854097366333)",International Bar,4.0,207,"Not a tourist trap*
Make some New Yorker friends and
get super wasted

*this place is authentic as fuck. Went on a saturday afternoon and got wasted with...",international-bar-new-york
292,"[Category(name='Pubs', alias='pubs')]","(40.7280197143555, -73.9812774658203)",11th Street Bar,4.0,121,"Not fancy, not pretentious....just a perfect neighborhood bar.  Attended a small private party here at the back of the bar.  The space was perfect for a...",11th-street-bar-new-york
293,"[Category(name='Cocktail Bars', alias='cocktailbars')]","(40.7518044, -74.0050735)",Porchlight,3.5,86,"Hidden gem located a little off the beaten path. Great cocktail bar for catching up with friends or out on a date. Well-lit, not overly crowded, and...",porchlight-new-york
294,"[Category(name='Dive Bars', alias='divebars')]","(40.8190956, -73.9374924)",A Touch of Dee,5.0,8,"Great place and super friendly! Sun-Tue 4 beers for $20, $7 cocktails. If Harlem were my home I'd be a regular. Don't expect anything fancy, this is a...",a-touch-of-dee-new-york
295,"[Category(name='American (New)', alias='newamerican'), Category(name='Lounges', alias='lounges'), Category(name='Cocktail Bars', alias='cocktailbars')]","(40.765751, -73.98317)",Ivy,3.5,244,"My husband and i went for happy hour after work. We were greeted and shown to our seats. Now mind you that the waitstaff is aloof half the time, and really...",ivy-new-york-4
296,"[Category(name='Pubs', alias='pubs'), Category(name='Trivia Hosts', alias='triviahosts'), Category(name='Cocktail Bars', alias='cocktailbars')]","(40.7771949768066, -73.95361328125)",Trinity Pub,4.0,98,"A gem of a bar on the UES in Yorkville. Small, comfy neighborhood feel. The kind of place you can make quick friends at the bar. There's a little alcove in...",trinity-pub-new-york
297,"[Category(name='Pubs', alias='pubs'), Category(name='Lounges', alias='lounges')]","(40.7283252192663, -73.9886448736218)",Burp Castle,4.0,496,"If you also enjoy a quite bar where you can actually hear yourself, then this is the place. The bartender will actually shush people if they talk too loud...",burp-castle-new-york
298,"[Category(name='Indian', alias='indpak'), Category(name='Cocktail Bars', alias='cocktailbars')]","(40.7389413, -73.9799477)",The Royal Munkey,4.5,82,"My husband and I have been here twice now (once to meet friends for drinks and dinner and once on a date night), and both times everything was PERFECT. 

I...",the-royal-munkey-new-york
299,"[Category(name='Party & Event Planning', alias='eventplanning'), Category(name='Bars', alias='bars')]","(40.74727, -73.9800645)",Birthday Bottle Service,5.0,164,I celebrated my 26th Birthday at Slate and had an amazing time! I filled out the form on the website and less than 15 mins Cristina contacted me. She asked...,birthday-bottle-service-new-york
300,"[Category(name='American (Traditional)', alias='tradamerican'), Category(name='Bars', alias='bars')]","(40.7600250426233, -73.9730061491484)",Monkey Bar,3.5,206,"Popped in on a weeknight and was promptly seated. The wait staff was excellent and the ambiance was wonderful!

Lobster risotto was delicious and my wife's...",monkey-bar-new-york
301,"[Category(name='Pubs', alias='pubs'), Category(name='Sports Bars', alias='sportsbars')]","(40.7322116600722, -73.9853242224027)",Finnerty's,4.0,289,You go to Finnerty's for one thing only: Bay Area sporting events. There is no competition (they'll tell overflow crowds to go to Plug Uglies but I'd rather...,finnertys-new-york
302,"[Category(name='Wine Bars', alias='wine_bars'), Category(name='Turkish', alias='turkish')]","(40.748093871977, -74.004119874834)",The Drunken Horse,4.0,75,"Simple menu, with GREAT options! 

I recommend the weekend happy hour 3-5 (I think). 

Regardless, I went with my mom and family friend. we stumbled upon...",the-drunken-horse-new-york
303,"[Category(name='Lounges', alias='lounges')]","(40.76538, -73.97895)",The Living Room,5.0,4,Stopped by for drinks and enjoyed the time.  I ordered the sweet rose champagne and he ordered the sparkling cider.  Lovely decor and professional service....,the-living-room-new-york-5
304,"[Category(name='Wine Bars', alias='wine_bars'), Category(name='Breakfast & Brunch', alias='breakfast_brunch'), Category(name='French', alias='french')]","(40.7476868, -74.0037054)",Le Pif,5.0,35,"Had the escargot!! Love it!  I even looked up the nutritional benefits of eating these things...the verdict: they're a good source of lean protein, iron and...",le-pif-new-york-8
