,categories,location,name,rating,review_count,snippet_text,yelp_id
760,"[Category(name='Lounges', alias='lounges')]","(40.7498099, -73.98602)",The Liquor Cabinet at The Gregory Hotel,4.5,5,"I really enjoyed my experience here. It's relatively new, and definitely feels that way. It has a homey charm about it, feeling more like a lounge or a...",the-liquor-cabinet-at-the-gregory-hotel-new-york
761,"[Category(name='Wine Bars', alias='wine_bars')]","(40.78492, -73.97291)",Vin Sur Vingt,4.5,7,Very cute neighborhood wine bar! They had an extremely varied selection of wines and great service. It had a relaxed vibe and was a wonderful place to have...,vin-sur-vingt-new-york-5
762,"[Category(name='Ramen', alias='ramen'), Category(name='Cocktail Bars', alias='cocktailbars')]","(40.7854, -73.977088)",Jin Ramen,4.0,318,"This was a great place to eat. Vibe was fun and modern. It was packed! Easy choices, not cluttered menu. Servers were nice, friendly, and quick. Definitely...",jin-ramen-new-york-3
763,"[Category(name='Mexican', alias='mexican'), Category(name='Cocktail Bars', alias='cocktailbars')]","(40.727123260498, -73.9881820678711)",Mayahuel,4.0,496,"Love this place.  It's a small tequila bar that also serves food, both upstairs and downstairs.  It has a romantic vibe to it so great date spot.

I've only...",mayahuel-new-york
764,"[Category(name='Italian', alias='italian'), Category(name='Breakfast & Brunch', alias='breakfast_brunch'), Category(name='Wine Bars', alias='wine_bars')]","(40.7313423, -74.0028996)",Baker & Co,4.0,366,"Delicious! 
Stopped by for lunch. Very reasonable prices. 
They have happy hour for beer and wine from 4 to 7pm. 
Definitely recommend you to visit.",baker-and-co-new-york
765,"[Category(name='Bars', alias='bars'), Category(name='Gastropubs', alias='gastropubs'), Category(name='American (New)', alias='newamerican')]","(40.739015, -74.001506)",CK14  The Crooked Knife,4.0,288,"Really solid unlimited brunch place, probably my favorite. The menu is diverse and the meal you get is well portioned for the amount of alcohol you will...",ck14-the-crooked-knife-new-york-2
766,"[Category(name='Mexican', alias='mexican'), Category(name='Bars', alias='bars')]","(40.718022, -73.990026)",Barrio Chino,4.0,911,Okay... Alright.  You think you can do this to ME?! Ya'll be writing yelp reviews in Rikers Island when I get finished with you.  I'm the man up in this...,barrio-chino-new-york
767,"[Category(name='French', alias='french'), Category(name='Pubs', alias='pubs')]","(40.760463700357, -73.9742553564245)",Papillon Bistro & Bar,3.0,254,"I can't comment on the food as I've only eaten here once, but I've come here for drinks countless times and with large groups. 

The food I have had was...",papillon-bistro-and-bar-new-york
768,"[Category(name='Lounges', alias='lounges')]","(40.7213593, -73.9942627)",Sweet & Vicious,3.0,407,"I am nearly 30 years old and I had a great time at Sweet & Vicious.

I'm hardly ever at the Lower East Side, but when your girlfriend decides to celebrate...",sweet-and-vicious-new-york
769,"[Category(name='Latin American', alias='latin'), Category(name='Seafood', alias='seafood'), Category(name='Cocktail Bars', alias='cocktailbars')]","(40.7609037798437, -73.9905203491259)",La Pulperia,4.5,418,"Wow wow wow, amazing place for Latin fusion food. Found this place using Yelp and my experience it's going outstanding !! 
Tip- the salmon brule good for...",la-pulperia-new-york-9
770,"[Category(name='Mexican', alias='mexican'), Category(name='Latin American', alias='latin'), Category(name='Cocktail Bars', alias='cocktailbars')]","(40.8004031, -73.9547097)",Cantina 1838,3.5,197,"I recently came here for the happy hour on Thursday.  First off the tacos were amazing, they had a lot of varieties. Secondly, the flavored margaritas were...",cantina-1838-new-york-3
771,"[Category(name='American (New)', alias='newamerican'), Category(name='Lounges', alias='lounges'), Category(name='Cocktail Bars', alias='cocktailbars')]","(40.74489, -73.983032)",PS 450,3.5,731,"Drinks 4 stars 

Food 5 stars

Manger 1 Star

Waitress 5 Stars

Music 4 Stars

Ambiance 4 stars 

Tables were super small.",ps-450-new-york
772,"[Category(name='Pubs', alias='pubs'), Category(name='American (New)', alias='newamerican')]","(40.728873, -73.987257)",Sly Fox,4.0,65,"In response to Iris:

This group was standing in the corner and out of nowhere the one guy stands up and starts yelling to the entire bar that he got hit...",sly-fox-new-york
773,"[Category(name='American (New)', alias='newamerican'), Category(name='Burgers', alias='burgers'), Category(name='Cocktail Bars', alias='cocktailbars')]","(40.7409706, -73.9820099)",Social Kitchen NYC,4.0,57,"This relatively large restaurant has an appealing variety of seating options - from bar stools at the bar and at high-tops to various dining-room tables, to...",social-kitchen-nyc-new-york
774,"[Category(name='Dance Clubs', alias='danceclubs'), Category(name='Lounges', alias='lounges')]","(40.7306935670033, -74.0009226385494)",The Village Underground,4.0,223,"--Sunday Night ""Ron Grant & Friends"" Open Mic Review--
**In November 2015, after over 16 years, Ron Grant & Friends ended its run at the Village Underground...",the-village-underground-new-york
775,"[Category(name='Burgers', alias='burgers'), Category(name='Mexican', alias='mexican')]","(40.7166907225542, -73.9999440120647)",Breakroom,4.5,1039,"This place really surprised me! They serve a couple of over the time items which can usually be hit or miss and here they were a hit!

The breakroom fries...",breakroom-new-york
776,"[Category(name='Lounges', alias='lounges'), Category(name='Cocktail Bars', alias='cocktailbars'), Category(name='Tobacco Shops', alias='tobaccoshops')]","(40.723620057106, -74.0044976770878)",SoHo Cigar Bar,4.0,142,"Great room

One of the few Cigar Lounges where you can Smoke, drink and eat at.

Service is always fast and accurate.

One of my favorite places in NYC",soho-cigar-bar-new-york-2
777,"[Category(name='Chinese', alias='chinese'), Category(name='Peruvian', alias='peruvian'), Category(name='Cocktail Bars', alias='cocktailbars')]","(40.7731835, -73.9856088)",Flor de Mayo,4.0,385,"This place has a unique concept of Chinese and Peruvian cuisine in one spot.  Last time we were in New York, we checked out pio pio, which was amazing.  To...",flor-de-mayo-new-york-3
778,"[Category(name='Bars', alias='bars'), Category(name='Arcades', alias='arcades')]","(40.7291107177734, -73.9895553588867)",Barcade,3.5,169,"Can't go wrong with beer and arcades!! This was our first location before we checked out the location at Midtown West. 

They have 24 rotating craft beers,...",barcade-new-york-8
779,"[Category(name='Pubs', alias='pubs'), Category(name='American (Traditional)', alias='tradamerican'), Category(name='Irish', alias='irish')]","(40.708065, -74.005104)",Ryan Maguire's Ale House,4.0,99,Ryan McGuire's Ale House is a place that I have eaten at multiple times during lunch time. I absolutely enjoy eating the restaurant's signature burger with...,ryan-maguires-ale-house-new-york
780,"[Category(name='Bars', alias='bars'), Category(name='American (Traditional)', alias='tradamerican')]","(40.7761497, -73.9561615)",Mad River Bar & Grill,3.5,164,"Best trivia night in NYC!
This place runs a competition every week where you can win money, free shots, and some conversation-starting prizes.

Love the...",mad-river-bar-and-grill-new-york
781,"[Category(name='Pubs', alias='pubs')]","(40.722728729248, -73.9890975952148)",The Late Late,3.5,71,"Came for a friend's bday, the upper bar area was where we first got in. Even with a guest list, which was capped at 25 people, we got in with an all girl...",the-late-late-new-york
782,"[Category(name='Bars', alias='bars')]","(40.73238, -74.0038457)",The Garret,3.5,134,So so much fun! Their cocktail list is inventive and the convenient location (above 5 guys) means you can basically have a fun night out and a late night...,the-garret-new-york
783,"[Category(name='Italian', alias='italian'), Category(name='Wine Bars', alias='wine_bars')]","(40.786492001724, -73.976464737317)",Spiga,4.0,187,"Place was solid.

Service solid. Atmosphere solid.  Food solid.",spiga-new-york
784,"[Category(name='Bars', alias='bars'), Category(name='Gastropubs', alias='gastropubs'), Category(name='American (New)', alias='newamerican')]","(40.72104, -73.9978299)",Brinkley's Broome Street,3.5,263,"Staff is super friendly. Excellent selection of local brews. Being from the west coast and accustomed to the craft brew scene, this place felt like...",brinkleys-broome-street-new-york-2
785,"[Category(name='Bars', alias='bars')]","(40.728347, -73.982215)",Hi-Fi,3.5,184,"Excellent service and happy hour prices.

My friend and I picked this place randomly as we walked by. From the moment we sat down till we left, the...",hi-fi-new-york
786,"[Category(name='Lounges', alias='lounges')]","(40.804016, -73.956024)",Harlem L Lounge,3.5,46,"This place has come a long way, from being a pub for residents, to now becoming the go to spot for after hours, clubbing scene (without the whole go-to a...",harlem-l-lounge-new-york
787,"[Category(name='American (New)', alias='newamerican'), Category(name='French', alias='french'), Category(name='Bars', alias='bars')]","(40.7774217133356, -73.9831341388358)",Cafe Luxembourg,4.0,345,This neighborhood spot is awesome for breakfast. I especially enjoy the french toast in the morning. It is the best french toast I ever had. It just melts...,cafe-luxembourg-new-york
788,"[Category(name='Dive Bars', alias='divebars'), Category(name='American (New)', alias='newamerican')]","(40.750011, -73.995468)",Tempest Bar,3.5,85,"I like it here .
Good service ,good Guinness .
For a good drink with no headaches .
My local!!",tempest-bar-new-york
789,"[Category(name='American (New)', alias='newamerican'), Category(name='Cocktail Bars', alias='cocktailbars'), Category(name='Venues & Event Spaces', alias='venues')]","(40.743507, -73.977165)",Hill and Bay,3.5,190,"I stopped by Hill & Bay for trivia night (Mondays, 8 p.m.) and had a really fun time! The winner gets $50 off their tab - sadly not me this time. Questions...",hill-and-bay-new-york
790,"[Category(name='Pubs', alias='pubs'), Category(name='Sports Bars', alias='sportsbars')]","(40.7493849, -73.995856)",Walter's Bar,3.5,53,Walters was a really fun late night bar and Olivia was a great bartender! Super fun evening!,walters-bar-new-york
791,"[Category(name='Mediterranean', alias='mediterranean'), Category(name='Wine Bars', alias='wine_bars'), Category(name='Tapas Bars', alias='tapas')]","(40.766758, -73.986144)",Kashkaval Garden,4.0,312,"Definitely 5 stars, and I'm stingy with my stars. 

I highly, highly recommend the kale salad. It's my go-to along with 478532 menu items. But really, it's...",kashkaval-garden-new-york
792,"[Category(name='Bars', alias='bars')]","(40.7400387954074, -73.9725351333618)",The Crow's Nest,3.5,27,"The Crow's Nest provides a nice waterside escape from the city.

This past Sunday, my friend and I came here for that very reason following the Pride...",the-crows-nest-new-york
793,"[Category(name='Irish', alias='irish')]","(40.7601257142679, -73.9953393915812)",Walter's Cottage,4.5,13,The best damn bartender for miles. Nole is a great host. Everything is great in this establishment.,walters-cottage-new-york
794,"[Category(name='Greek', alias='greek'), Category(name='Mediterranean', alias='mediterranean'), Category(name='Pubs', alias='pubs')]","(40.7653, -73.97803)",Loi Estiatorio,4.5,149,Yummy yummy yummy. So delish. The chef is very talented and so warm. Actually came and sat down for a few min with us. Every course was incredible (did a...,loi-estiatorio-new-york
795,"[Category(name='Irish', alias='irish'), Category(name='Pubs', alias='pubs'), Category(name='Sports Bars', alias='sportsbars')]","(40.7271881103516, -73.9851989746094)",The Grafton,4.0,26,"I'll be honest--I like the Grafton. I 4.25 stars like Grafton, maybe even 4.5. But I'm giving it a 5 for one simple reason--well, maybe 6 or 7 reasons--the...",the-grafton-new-york
796,"[Category(name='Wine Bars', alias='wine_bars'), Category(name='Tapas/Small Plates', alias='tapasmallplates'), Category(name='French', alias='french')]","(40.7265, -73.9840399)",Ruffian Wine Bar & Chef's Table,5.0,71,"At first, it seems like an unassuming tiny space sandwiched in between two crowded hyped-up dessert shops, but I love this place! It has an elegant,...",ruffian-wine-bar-and-chefs-table-new-york
797,"[Category(name='Australian', alias='australian'), Category(name='Wine Bars', alias='wine_bars')]","(40.7280068, -73.98191)",Flinders Lane,4.0,163,"I have mentioned before that I pretty much gave up on brunch. It is so crowded and I am happy to eat outside the hours of 10AM - 4PM any day. 

Anywho. 

As...",flinders-lane-new-york
798,"[Category(name='American (Traditional)', alias='tradamerican'), Category(name='Breakfast & Brunch', alias='breakfast_brunch'), Category(name='Brasseries', alias='brasseries')]","(40.755165, -73.967868)",The Smith,4.0,1231,"We shared the avocado toast and the Sicilian baked eggs. The avocado toast was good, lemony like guac, and the poached eggs were a good balance with the...",the-smith-new-york-2
799,"[Category(name='Sandwiches', alias='sandwiches'), Category(name='Bars', alias='bars'), Category(name='Steakhouses', alias='steak')]","(40.7034454, -74.0110779)",Shorty's,4.0,171,"Dropped by here for a quick lunch and a cold brew after our ferry ride to the Statue of Liberty. 

Our waitress seated us right away, explained the menu and...",shortys-new-york-3
800,"[Category(name='American (New)', alias='newamerican'), Category(name='Bars', alias='bars')]","(40.732769350531, -73.9879221018525)",The Brazen Fox Kitchen & Craft Beer,3.5,221,"Ambience: 3.5
Food: 3.5
Service: 4
Bathroom: 4
Average: 3.75 (rounded up to 4)

Let's paint the picture: it's a Saturday night, my friends from MA are here...",the-brazen-fox-kitchen-and-craft-beer-new-york
801,"[Category(name='Pubs', alias='pubs'), Category(name='Irish', alias='irish')]","(40.764812, -73.982978)",McGee's,3.5,382,Awesome bar. There are two levels. Main level plays upbeat music. Upstairs plays relaxed music. They have several TVs playing sports. The bar definitely...,mcgees-new-york-2
802,"[Category(name='American (Traditional)', alias='tradamerican'), Category(name='Sports Bars', alias='sportsbars')]","(40.7444933426112, -73.9917504787445)",Rogue,3.5,266,Decent post work hh spot.  It's pretty central on 25th & 6th- hh goes until 7:00pm.  Inside was much bigger and more spacious than I expected.  I ordered...,rogue-new-york-2
803,"[Category(name='Japanese', alias='japanese'), Category(name='Bars', alias='bars'), Category(name='Tapas/Small Plates', alias='tapasmallplates')]","(40.7302936375097, -73.9820877568119)",Teshigotoya,4.0,37,"Cute as a button, free jazz, amazing food, adorable service. Who could ask for more? 

Opt for the Omakase- even ordered for one is plenty of food for two....",teshigotoya-new-york-3
804,"[Category(name='Bars', alias='bars')]","(40.7663553151525, -73.9684152603149)",Bar Seine,4.0,5,"Bar Seine is an elegant little gem. I have enjoyed both cocktails and afternoon tea at this quiet oasis. The rooms are quite ""clubby"" (no, not that kind of...",bar-seine-new-york
805,"[Category(name='Lounges', alias='lounges')]","(40.809116, -73.951537)",W XYZ Bar,3.5,30,"Beautiful decor. I think it's the only place in harlem with a pool table.

The DJ there was great! Everyone was dancing and drinking. It was weird seeing a...",w-xyz-bar-new-york
806,"[Category(name='Sports Bars', alias='sportsbars')]","(40.729954, -73.980316)",The Horse Box,4.0,90,"What a great bar!  I came here with a friend to catch a few beers and the Knicks game.  We were in the area, and after reading up on some bars on Yelp, I...",the-horse-box-new-york
807,"[Category(name='Breakfast & Brunch', alias='breakfast_brunch'), Category(name='American (Traditional)', alias='tradamerican'), Category(name='Bars', alias='bars')]","(40.719352, -73.986686)",Schiller's Liquor Bar,3.5,790,Originally went to Freeman's for brunch around 4 and was told they were closing up but recommended Schiller's since they do brunch until 5 on Sunday. We'll...,schillers-liquor-bar-new-york
808,"[Category(name='American (New)', alias='newamerican'), Category(name='Beer Gardens', alias='beergardens')]","(40.75553, -73.9684)",The Stag's Head,4.0,312,Came to The Stags Head just a few days ago when it was suggested to me through a friend for lunch. I don't know why but for some reason when I walked in...,the-stags-head-new-york-2
809,"[Category(name='French', alias='french'), Category(name='Wine Bars', alias='wine_bars')]","(40.7487053, -73.987317)",Petit Poulet,4.0,199,"Gem of a French cafe in the heart of Koreatown!
Came in just after 5 on Wednesday for a romantic dinner. Everything was first rate!
Our server was...",petit-poulet-new-york
810,"[Category(name='Mexican', alias='mexican'), Category(name='Bars', alias='bars'), Category(name='Tex-Mex', alias='tex-mex')]","(40.8094691974268, -73.9537807693115)",Lulu's Taqueria,3.5,120,"First time at Lulus and won't be the last . Hidden gem in Harlem. Great drinks and fresh flavors from all we ate.

The coconut curry shrimp tacos were a tad...",lulus-taqueria-new-york
811,"[Category(name='French', alias='french'), Category(name='Bars', alias='bars'), Category(name='Pizza', alias='pizza')]","(40.7454955900215, -73.9795761190491)",La Tarte Flambee,4.5,165,"Bottomless mimosas and one of their delicious savory flambees during brunch on weekends for 29.99. 
(1 hour Bottomless, can also have eggs Benedict as the...",la-tarte-flambee-new-york-4
812,"[Category(name='Pubs', alias='pubs'), Category(name='Irish', alias='irish')]","(40.776298, -73.955497)",Dylan Murphy's,3.5,70,"I have been here a number of times in the last few years.  Only a complete block-head would write that this place is 100% bridge and tunnel people.

The...",dylan-murphys-new-york
813,"[Category(name='Cajun/Creole', alias='cajun'), Category(name='Southern', alias='southern'), Category(name='Sports Bars', alias='sportsbars')]","(40.760318, -73.989784)",Bourbon Street Bar & Grille,3.5,619,"Stopped here for dinner after the theatre.  Served by Daniel at the back bar - great service! 
I had the gumbo soup as an appetizer - outstanding as good as...",bourbon-street-bar-and-grille-new-york
814,"[Category(name='Mexican', alias='mexican'), Category(name='American (Traditional)', alias='tradamerican'), Category(name='Bars', alias='bars')]","(40.780883, -73.980384)",Playa Betty's,3.5,205,"Amazing service, and awesome collection of tacos. I tried the hass, baja and southern girl. All were good, and 2 of them were nice and crispy which I liked...",playa-bettys-new-york-2
815,"[Category(name='Cocktail Bars', alias='cocktailbars'), Category(name='American (New)', alias='newamerican')]","(40.7438322669668, -73.9880068207382)",230 Fifth Rooftop Bar,3.0,1961,"I came here for a corporate event. 
We had closed off half of the roof for our work function. The service was great and the food, drinks were good as well....",230-fifth-rooftop-bar-new-york
816,"[Category(name='Cocktail Bars', alias='cocktailbars')]","(40.722236, -73.983009)",The Mockingbird,4.5,10,"Came here last night around 11 pm, the ambiance was a little boring 'cause it was still early but then around 1am it all started to gain life and people...",the-mockingbird-new-york
817,"[Category(name='Bars', alias='bars'), Category(name='Gastropubs', alias='gastropubs')]","(40.7299485, -73.980941)",The Spotted Owl Tavern,4.0,18,Love this place! Our bartender was really cool and attentive and the grilled cheese was awesome. Definitely a new go-to spot for me.,the-spotted-owl-tavern-new-york
818,"[Category(name='Mediterranean', alias='mediterranean'), Category(name='Lounges', alias='lounges'), Category(name='Hookah Bars', alias='hookah_bars')]","(40.7680244445801, -73.9550094604492)",AMOUN Mediterranean Kitchen & Lounge,4.0,83,"I went to Amoun Mediterranean Kitchen & Lounge for my birthday dinner and it was exactly what I was in the mood for having dinner with my boyfriend. 
It was...",amoun-mediterranean-kitchen-and-lounge-new-york-2
819,"[Category(name='Sports Bars', alias='sportsbars'), Category(name='Pubs', alias='pubs'), Category(name='Irish', alias='irish')]","(40.7304993, -73.9898911)",Central Bar,3.5,354,"I've never ordered the food here, so this review is mostly for the second floor (dance floor). This is by far the most accommodating place I've been to. 

I...",central-bar-new-york
820,"[Category(name='Gay Bars', alias='gaybars'), Category(name='Dive Bars', alias='divebars')]","(40.762807689975, -73.9932782367628)",Dive Bar Lounge,3.5,28,"The $5 frozen margaritas and other drinks specials rule! Plus, on Sundays, they play some amazing music in the later afternoon, which can make for an...",dive-bar-lounge-new-york
821,"[Category(name='Pubs', alias='pubs'), Category(name='Burgers', alias='burgers')]","(40.771524604477, -73.9827515606251)",PJ Clarke's,3.0,536,"My first time dinning at PJ Clarks in Lincoln Center and it will not be my last.  Was so impressed with the service, drinks and food. The restaurant is very...",pj-clarkes-new-york-3
822,"[Category(name='American (Traditional)', alias='tradamerican'), Category(name='Pubs', alias='pubs')]","(40.7481499, -73.9865189)",Foley's NY,4.0,184,"Baseball, baseball, baseball. A great sports bar in the heart of herald square with no frills, no pretentiousness, but lots of fun. The service is friendly...",foleys-ny-new-york
823,"[Category(name='American (New)', alias='newamerican'), Category(name='Wine Bars', alias='wine_bars'), Category(name='Breakfast & Brunch', alias='breakfast_brunch')]","(40.766139, -73.97998)",9ten Restaurant,4.0,45,"Ate here for dinner last night.

We were sat right away and the staff was very friendly.

Their food was amazing and they even had iced coffee!!

The best...",9ten-restaurant-new-york
824,"[Category(name='Bars', alias='bars')]","(40.7201343, -73.9847086)",Donnybrook,3.5,119,Stopped by for lunch/brunch on a Saturday.  Busy but not crowded.  I had a seat at the bar.  Their Shepherd's Pie is pretty good - not the best in NYC but a...,donnybrook-new-york
825,"[Category(name='German', alias='german'), Category(name='Bars', alias='bars')]","(40.77742, -73.9517212)",Heidelberg Restaurant,4.0,474,One of my favorite German restaurants in the city! Food is great! It is true homemade German food. You get the feeling that you are at your grandmothers as...,heidelberg-restaurant-new-york
826,"[Category(name='American (New)', alias='newamerican'), Category(name='Sports Bars', alias='sportsbars'), Category(name='Cocktail Bars', alias='cocktailbars')]","(40.761348, -73.987228)","Social Bar, Grill & Lounge",3.5,240,"Been here a few times for After parties after the NYWEA conference at the Marriott. They do a pretty good job hosting parties, two bartenders, passed around...",social-bar-grill-and-lounge-new-york
827,"[Category(name='Barbeque', alias='bbq'), Category(name='Sports Bars', alias='sportsbars')]","(40.7297465, -73.9806418)",Percy's BBQ & Darts,4.0,120,"Best BBQ in Nyc ! 
Fun place .. Really good service .. Worth a trip 
Play some darts and have a drink",percys-bbq-and-darts-new-york
828,"[Category(name='Performing Arts', alias='theater'), Category(name='Bars', alias='bars')]","(40.7204704, -73.9928131)",Dixon Place,4.0,20,"i had a wonderfull experience at the dixon place, it's a cool s all bar with a stage and theatre. i went there for a communitas performance which was great...",dixon-place-new-york
829,"[Category(name='Cocktail Bars', alias='cocktailbars')]","(40.7067791372538, -74.0076633542776)",Cedar Local,3.5,48,"The Royalé with Cheese is the best burger I've ever had in  my life...holy cow! I don't usually eat burgers, only In-N-Out in California or sometimes I'll...",cedar-local-new-york
830,"[Category(name='Pubs', alias='pubs'), Category(name='Irish', alias='irish')]","(40.7498016357422, -73.9851379394531)",O'Reilly's Bar + Kitchen,3.5,72,"Came here on a Sunday night after a show with my boyfriend. We're not from NYC, so we had searched around and decided to check this place out. We were...",o-reillys-bar-kitchen-new-york
831,"[Category(name='Pubs', alias='pubs')]","(40.814716, -73.959511)",Paddy's,3.5,25,A great place to grab a drink at a good price with a wide variety of fun events. Pizza isn't great but what would you expect from a bar pie?,paddys-new-york
832,"[Category(name='Wine Bars', alias='wine_bars'), Category(name='Italian', alias='italian')]","(40.7212622, -73.9954775)",Epistrophy,3.5,330,Had the Short Rib and Arugula Fig salad. We had a taste and realized how good it was and only then thought about taking photos and posting a review - so...,epistrophy-new-york
833,"[Category(name='American (New)', alias='newamerican')]","(40.738527, -73.988417)",Gramercy Tavern,4.5,2033,"I could give you a long-winded review about how much I loved Gramercy Tavern at first sight, starting with stepping foot into the restaurant, our most...",gramercy-tavern-new-york
834,"[Category(name='Arcades', alias='arcades'), Category(name='Dive Bars', alias='divebars')]","(40.725051, -73.981475)",7B Horseshoe Bar aka Vazacs,3.5,152,"Cool divey bar! Came in with a friend to have a beer and noticed all the cool machinery (arcade, juke box).

Pretty calm in a Tuesday evening!",7b-horseshoe-bar-aka-vazacs-new-york
835,"[Category(name='Pubs', alias='pubs')]","(40.7364240384139, -73.9848463081818)",Paddy Maguire's Ale House,4.0,49,"Fantastic place
Bartender is dympna and she is fantastic 
Very attentive and never asked cause she was there",paddy-maguires-ale-house-new-york
