,categories,location,name,rating,review_count,snippet_text,yelp_id
459,"[Category(name='American (Traditional)', alias='tradamerican'), Category(name='Sports Bars', alias='sportsbars')]","(40.784759, -73.977546)",The Gin Mill,3.5,288,"Great place on the UWS for cheap beer and food. It has a fun laid back atmosphere, and is always pretty loud. 

If you're looking for an up scale bar with a...",the-gin-mill-new-york
460,"[Category(name='Performing Arts', alias='theater'), Category(name='Bars', alias='bars'), Category(name='American (Traditional)', alias='tradamerican')]","(40.75658, -73.98865)",Speakeasy Dollhouse -  Ziegfeld's Midnight Frolic,3.5,57,This show really was unique! The star Oliver had one of the best singing voices I've ever heard and she was stunning. Some people dressed up in costume...,speakeasy-dollhouse-ziegfelds-midnight-frolic-new-york
461,"[Category(name='Breakfast & Brunch', alias='breakfast_brunch'), Category(name='American (New)', alias='newamerican'), Category(name='Lounges', alias='lounges')]","(40.7218938837555, -73.9925052386644)",Freemans,4.0,1574,"Great place for brunch, and as it turns out, also a solid choice for dinner.

The hot artichoke dip is a standout. Good cocktails. I had something called...",freemans-new-york-3
462,"[Category(name='Bars', alias='bars'), Category(name='Music Venues', alias='musicvenues')]","(40.777126, -73.953453)",Brandy's Piano Bar,3.5,176,Great place to just let go and have fun...it looks like just a regular bar and for the most part it is. Except for the amazingly gay piano player who makes...,brandys-piano-bar-new-york
463,"[Category(name='Pubs', alias='pubs'), Category(name='German', alias='german')]","(40.72421, -73.978862)",Zum Schneider,4.0,525,Doors and windows wide open on sunny days (I would say beautiful days but I hate the heat). German beer served in huge quantities. Wine and cider available...,zum-schneider-new-york
464,"[Category(name='American (New)', alias='newamerican'), Category(name='Bars', alias='bars')]","(40.7251701, -73.9925385)",Saxon + Parole,4.0,566,"Came here with friends for dinner and completely loved!

The decor is adorable, very farmhouse-chic with tons of small twinkling lights. Ambiance is upscale...",saxon-parole-new-york
465,"[Category(name='Bars', alias='bars'), Category(name='American (New)', alias='newamerican')]","(40.719711, -73.997848)",Onieal's Grand Street Bar & Restaurant,4.0,219,"Onieal's always provides a solid experience. They meet and exceed the NYC standard for food, drinks, and service. 
The decor is warm, inviting, and classic....",onieals-grand-street-bar-and-restaurant-new-york
466,"[Category(name='Italian', alias='italian'), Category(name='Bars', alias='bars')]","(40.761195, -73.9859352)",Cielo At the Mayfair,4.0,228,My family and I ate here before attending a Broadway show (Kinky Boots). It would have been fortuitous if we were attending Book of Mormon since that is...,cielo-at-the-mayfair-new-york-3
467,"[Category(name='Wine Bars', alias='wine_bars'), Category(name='Latin American', alias='latin')]","(40.75562, -73.99445)",Ooviña,4.0,132,"I couldn't stop squealing about the decor...#basic, I know, but I loved the vines and flowers along the walls and ceiling. Perfect for a date or night out...",ooviña-new-york-3
468,"[Category(name='Bars', alias='bars'), Category(name='American (Traditional)', alias='tradamerican')]","(40.726722, -73.98381)",East Village Social,4.0,91,"By far the best vibe in the East Village. Great, intimate atmosphere, awesome bartenders, good music, and usually gory cult movies on the TV. Generally not...",east-village-social-new-york
469,"[Category(name='Coffee & Tea', alias='coffee'), Category(name='Wine Bars', alias='wine_bars'), Category(name='Cafes', alias='cafes')]","(40.729534, -73.999488)",VBar&cafe,4.0,212,"Vbar&Café was a stumble upon stop thanks to my agitated and thirsty Mother and Yelp. She clearly was done with my walking, shopping and talking and,...",vbar-and-cafe-new-york-4
470,"[Category(name='Lounges', alias='lounges'), Category(name='Hookah Bars', alias='hookah_bars'), Category(name='Dance Clubs', alias='danceclubs')]","(40.7590792, -73.9884589)",Iron Bar & Lounge,3.5,269,"Came here for my brother's birthday party. Although the staff/management was not that helpful with the planning and coordinating of my event, everything...",iron-bar-and-lounge-new-york-3
471,"[Category(name='Bars', alias='bars')]","(40.72631, -73.97756)",Evelyn,3.5,84,"I was surprised to see so many so-so reviews of this bar, and so I wanted to balance the scales a bit in Evelyn's favor because I've had so many great...",evelyn-new-york
472,"[Category(name='Cocktail Bars', alias='cocktailbars'), Category(name='American (New)', alias='newamerican'), Category(name='Music Venues', alias='musicvenues')]","(40.7287913560867, -73.9845903217793)",Pinks,4.0,71,"I like this place a lot !! The bouncer was very confrontational but the rest of the staff was very friendly, especially the host of the event. I liked rock...",pinks-new-york
473,"[Category(name='Korean', alias='korean'), Category(name='Cocktail Bars', alias='cocktailbars')]","(40.746854, -73.9845201)",Bangia,4.0,129,"This probably the third place I went to tonight  (lol)

Very friendly staff, like super nice.
More of my type of environment, not too crowed at the bar but...",bangia-new-york-2
474,"[Category(name='French', alias='french'), Category(name='Bars', alias='bars'), Category(name='Cafes', alias='cafes')]","(40.763462, -73.967811)",Maison Hugo,4.0,21,"I took my wife to Maison Hugo first chance and we both enjoyed tremendously. 

This is a great place to have a drink, enjoy genuine French food creatively...",maison-hugo-new-york
475,"[Category(name='American (New)', alias='newamerican'), Category(name='Pubs', alias='pubs'), Category(name='Pool Halls', alias='poolhalls')]","(40.7322, -74.00003)",Formerly Crow's,4.0,51,"Really affordable prices, good happy hour deal very good service plus delicious food and they close until 4am. Cant ask fpr anything better! Definitely will...",formerly-crows-new-york
476,"[Category(name='Lounges', alias='lounges'), Category(name='American (New)', alias='newamerican')]","(40.718487, -74.004955)",South's Bar,4.0,175,Classy front with large windows from floor to ceiling. Lighting was perfect - not too dim and has plenty of natural sunlight. Perfect cute little spot for...,souths-bar-new-york
477,"[Category(name='American (New)', alias='newamerican'), Category(name='Bars', alias='bars'), Category(name='Vegetarian', alias='vegetarian')]","(40.7662355, -73.9658007)",The East Pole,3.5,147,"Pickings are pretty slim for trendy and delicious spots on the Upper East Side. In fact, I can count on two hands the amount of places that I'd truly...",the-east-pole-new-york
478,"[Category(name='Dive Bars', alias='divebars')]","(40.72464, -73.99459)",Milano's Bar,4.0,121,Milano's looks like a miserable place from the outside. But boy do they have a great happy hour or its that bar that's cheap enough to come in at any hour....,milanos-bar-new-york
479,"[Category(name='Pubs', alias='pubs'), Category(name='Irish', alias='irish'), Category(name='Dive Bars', alias='divebars')]","(40.7624168, -73.9899445)",Gaf West,4.0,74,It was a night to remember. A night for passion. A night for... love? The unusually frigid air whipped at my inexplicably exposed silky blouse under a...,gaf-west-new-york
480,"[Category(name='American (New)', alias='newamerican'), Category(name='Cocktail Bars', alias='cocktailbars'), Category(name='Sports Bars', alias='sportsbars')]","(40.749403, -73.994049)",American Whiskey,3.5,209,"Regretfully, I need to go to Sloan Kettering a few times a year for medical checkups.  My wife and I take the train to Manhattan and we love this little gem...",american-whiskey-new-york
481,"[Category(name='Sports Bars', alias='sportsbars'), Category(name='Pubs', alias='pubs')]","(40.7559502, -73.9907608)",Beer Authority,3.5,449,"This place is actually pretty great! Wish we discovered it earlier. It's right off the 42nd/PATH metro stop so super easy to find

They played awesome...",beer-authority-new-york
482,"[Category(name='Bars', alias='bars')]","(40.718826, -73.986862)",Nurse Bettie,4.0,241,"I hear they have burlesque shows here but I've never been to one, just hasn't worked out that way... yet. BUT I did come here one Halloween and it was kind...",nurse-bettie-new-york
483,"[Category(name='Wine Bars', alias='wine_bars')]","(40.714775, -73.990852)",Clandestino,4.0,95,"I came here on a whim for my birthday with my group.  They were very accommodating to our large crowd. 

The drinks were pour well and the bartenders were...",clandestino-new-york
484,"[Category(name='Lounges', alias='lounges'), Category(name='Cocktail Bars', alias='cocktailbars')]","(40.726728, -73.999755)",Pegu Club,4.0,866,"Such a cute bar/lounge in the Soho area! Never heard of this place until my date suggested to meet up here. 

Actual establishment is located on the 2nd...",pegu-club-new-york
485,"[Category(name='Bars', alias='bars'), Category(name='Mexican', alias='mexican')]","(40.762138, -73.990314)",Casa Agave NYC,4.0,223,"OH THIS PLACE IS DELICIOUS!

I went here with my coworker and we ordered tacos from their lunch menu. It was surprisingly cheap and delicious. They give you...",casa-agave-mexican-bar-grill-new-york
486,"[Category(name='Bars', alias='bars'), Category(name='American (Traditional)', alias='tradamerican')]","(40.7323193887187, -73.9876905276754)",Linen Hall,4.0,117,Loved it. We rented this place out for an Open Bar Fundraiser through our non-profit (Back on My Feet). Amazing space & really attentive staff. Can...,linen-hall-new-york
487,"[Category(name='Wine Bars', alias='wine_bars')]","(40.741879, -73.977752)",Vanguard Wine Bar,4.0,51,Best first date/date spot in nyc. Big bar to sit at incase you don't like the awkwardness of sitting at a table(although they have that too) oldies playing...,vanguard-wine-bar-new-york
488,"[Category(name='Lounges', alias='lounges')]","(40.7653, -73.97184)",Two E Bar/Lounge,4.0,72,"My friends and I came here for a Birthday recently, and we were VERY impressed!
The place is absolutely gorgeous and the bartender, Paul, took great care of...",two-e-bar-lounge-new-york
489,"[Category(name='Jazz & Blues', alias='jazzandblues'), Category(name='Dive Bars', alias='divebars')]","(40.8138656616211, -73.9468307495117)",American Legion Post 398,4.0,27,"Great jazz in a speak easy style brownstone in Harlem .
Wednesday jazz was awesome !
I hear it's closed the beginning of the week .
Call first .
No cover...",american-legion-post-398-new-york
490,"[Category(name='Breakfast & Brunch', alias='breakfast_brunch'), Category(name='American (Traditional)', alias='tradamerican'), Category(name='Bars', alias='bars')]","(40.7414165692826, -74.0054237864776)",The Green Table,4.0,454,"Very good brunch, portion sizes could be bigger.

Service was very swift and attentive.

Chelsea Market is awesome",the-green-table-new-york-2
491,"[Category(name='Bars', alias='bars')]","(40.7821270933307, -73.9802539926003)",LOCL Bar,3.5,18,Went there last Saturday night after a movie and it's really awesome.  You can listen to live music and drink AND have your dog with you.  I mean how great...,locl-bar-new-york-2
492,"[Category(name='Sports Bars', alias='sportsbars'), Category(name='Burgers', alias='burgers'), Category(name='American (Traditional)', alias='tradamerican')]","(40.7630188, -73.9861591)",The House of Brews,3.5,289,We came here to House Of Brews after we tried another place that was full... And I'm GLAD we did!!! I was shockingly surprised how empty this place was for...,the-house-of-brews-new-york-5
493,"[Category(name='American (Traditional)', alias='tradamerican'), Category(name='Pubs', alias='pubs')]","(40.8016022, -73.9705556)",Ellington In The Park,3.5,43,"If you don't know how to find Ellington in the Park, it can be quite the adventure.

The park is great to begin with and having a western view as the sun...",ellington-in-the-park-new-york-2
494,"[Category(name='American (Traditional)', alias='tradamerican'), Category(name='Pubs', alias='pubs')]","(40.771146, -73.956228)",The Stumble Inn,3.5,360,"So, I have been getting judged super hard by some friends for saying that I like this place, but this place is definitely my kind of bar.

Cheap drinks...",the-stumble-inn-new-york
495,"[Category(name='Bars', alias='bars'), Category(name='American (New)', alias='newamerican'), Category(name='Gastropubs', alias='gastropubs')]","(40.72705078125, -73.9892044067383)",Cooper's Craft & Kitchen,4.0,282,"Food is alright and three stars worthy however the deals after 5pm take it up to four stars.

Fish tacos are great (ask for the hot sauce)  and there's a...",coopers-craft-and-kitchen-new-york
496,"[Category(name='Dive Bars', alias='divebars')]","(40.73832, -73.99836)",Bunga's Den,3.5,76,"Relaxed, divey bar with good drinks for a fair price.  Always ordered their Margaritas ($7 apiece) and never been disappointed; the barman has never...",bungas-den-new-york
497,"[Category(name='Pubs', alias='pubs'), Category(name='American (New)', alias='newamerican'), Category(name='Sports Bars', alias='sportsbars')]","(40.73903, -73.98278)",Taproom No. 307,3.5,336,"Very extensive craft selection, many taps, but not really anything good. If it wasn't for the Gubna they had that day, I would have had water. Their house...",taproom-no-307-new-york
498,"[Category(name='Lounges', alias='lounges')]","(40.76836, -73.98493)",Sky Terrace at Hudson,4.0,63,"I like this place - mostly because so few people know of it so it's probably best not to even leave a review, but I will.

This is a rooftop in a hotel that...",sky-terrace-at-hudson-new-york
499,"[Category(name='Bars', alias='bars'), Category(name='American (Traditional)', alias='tradamerican'), Category(name='Creperies', alias='creperies')]","(40.72992, -73.99927)",Shade,4.0,167,Very good and I love to go here for lunch when I've had a long morning and just need a change of scenery without going too far. The vibe is very nice and I...,shade-new-york
500,"[Category(name='American (New)', alias='newamerican'), Category(name='Bars', alias='bars'), Category(name='Breakfast & Brunch', alias='breakfast_brunch')]","(40.723690032959, -73.9877853393555)",Spiegel,4.0,169,"Had a wonderful brunch experience. It's super trendy with its wide glass windows, TV, tasteful rows of alcohol, and hipster crowd. It's in the east...",spiegel-new-york-2
501,"[Category(name='Tapas Bars', alias='tapas'), Category(name='American (New)', alias='newamerican'), Category(name='Wine Bars', alias='wine_bars')]","(40.7594098, -73.9929134)",Adella,4.0,89,"Wine: Excellent
Cheese & Charcuterie: Way better than most places I've tasted 
Mussels: Very good
Tartar: Delicious

I have liked everything I have tried...",adella-new-york
502,"[Category(name='Lounges', alias='lounges'), Category(name='Korean', alias='korean'), Category(name='American (New)', alias='newamerican')]","(40.7467294, -73.9848598)",Ichi Cellar,4.0,48,"Ichi Cellar is a lounge in the heart of Koreatown in New York City.  I really enjoy Ichi Cellar because it is ""hidden"" downstairs under the famous Ichi Umi...",ichi-cellar-new-york-2
503,"[Category(name='Bars', alias='bars'), Category(name='Arcades', alias='arcades'), Category(name='Burgers', alias='burgers')]","(40.744243, -73.994506)",Barcade,3.5,220,Yea so this place has the Konami X-Men arcade game. That's an automatic 3 stars for me. Had to bump it up a star because the night crowd isn't as bad as I...,barcade-new-york-5
504,"[Category(name='Bars', alias='bars')]","(40.73453, -73.98773)",Revival,3.5,228,"Interesting space + Awesome happy hour = perfect drunkeness

I'll be back (terminator voice)",revival-new-york
505,"[Category(name='Bars', alias='bars'), Category(name='American (Traditional)', alias='tradamerican'), Category(name='Food Court', alias='food_court')]","(40.7501454808012, -73.9915624404056)",The Pennsy,3.5,151,"FINALLY. Penn Station, you're slowly stepping it up. I don't know about you, but for my fellow commuters - when I used to live on LI and if there was a...",the-pennsy-new-york
506,"[Category(name='Sports Bars', alias='sportsbars'), Category(name='American (New)', alias='newamerican'), Category(name='Breakfast & Brunch', alias='breakfast_brunch')]","(40.769802, -73.9542)",Mile 17 Bar & Restaurant,4.0,40,"Cleverly named for being the marker of the 17th Mile for the NY Marathon, this place is a hit.

First came here to watch some March Madness - (screens...",mile-17-bar-and-restaurant-new-york
507,"[Category(name='Spanish', alias='spanish'), Category(name='Tapas Bars', alias='tapas'), Category(name='Wine Bars', alias='wine_bars')]","(40.7402927726298, -73.9940709810079)",Boqueria,4.0,881,"TODO:

Yelp won't let me put this restaurant on a list unless I write a review (Yelp, please change this policy!)

Therefore, this is a stub review for the...",boqueria-new-york
508,"[Category(name='German', alias='german'), Category(name='Bars', alias='bars')]","(40.75255, -73.97338)",Bierhaus NYC,3.5,411,"Amazing restaurant & bar, with a great and an authentic German atmosphere! The food is incredible and the beer follows suit! There are also great events...",bierhaus-nyc-new-york-4
509,"[Category(name='American (New)', alias='newamerican'), Category(name='Lounges', alias='lounges'), Category(name='Venues & Event Spaces', alias='venues')]","(40.7643203735352, -73.9838027954102)",Feinstein's/54 Below,4.0,103,"AMAZING!!!! Oh and if your into Broadway - this is a great networking spot! 

Of course it's a supper club, it's pricey, it's New York! It's pricey! Just...",feinsteins-54-below-new-york-3
510,"[Category(name='Pubs', alias='pubs'), Category(name='American (New)', alias='newamerican')]","(40.7814117451455, -73.9799106589601)",Amsterdam Ale House,3.0,270,"Sometimes New Yorker can be so fickle.  This place seems to work for me. It's crowded, got a great beer selection and the food tasted great! Didn't seem to...",amsterdam-ale-house-new-york
511,"[Category(name='Bars', alias='bars'), Category(name='American (New)', alias='newamerican')]","(40.8148613, -73.9593964)",Toast,3.5,230,"I finally checked this spot out. I always assumed it was super expensive, but the prices are pretty decent for the area. 

I got a burger with a salad and...",toast-new-york-6
512,"[Category(name='Wine Bars', alias='wine_bars'), Category(name='American (New)', alias='newamerican')]","(40.759748, -73.965299)",Kurant,4.0,95,I can say this place is one of those wonderful places in Manhattan that make you feel at home. The service is sort friendly and amazingly attentive. Things...,kurant-new-york-2
513,"[Category(name='French', alias='french'), Category(name='Wine Bars', alias='wine_bars'), Category(name='Breakfast & Brunch', alias='breakfast_brunch')]","(40.7774844970442, -73.9817932784042)",Le Pif,4.0,126,Wednesday dinner what an experience! What a pleasure! What a delight! One word... Amazing ! and service was spectacular... Very personable service yet still...,le-pif-new-york-6
514,"[Category(name='Irish', alias='irish'), Category(name='Pubs', alias='pubs')]","(40.783851, -73.949892)",The District,3.0,227,"Currently my favorite spot on the UES, The District is staffed by a colorful but professional staff of lovable knuckleheads and features a menu of quality...",the-district-new-york
515,"[Category(name='Lounges', alias='lounges')]","(40.73203, -73.98377)",Crocodile Lounge,3.5,694,Love love love this place. BOGO DEAL!  It's a buy one get one free sort of deal with pizza and beer! My friends and I usually go to this spot first when we...,crocodile-lounge-new-york
516,"[Category(name='Cocktail Bars', alias='cocktailbars'), Category(name='Seafood', alias='seafood'), Category(name='American (New)', alias='newamerican')]","(40.76733, -73.989456)",White Oak Oyster Bar & Cocktail Lounge,4.0,112,"I've been to White Oak Oyster Bar twice in 2 weeks for their $1 happy hour oyster special. 

Actually I'd be happy to eat oysters all day.  White Oak comes...",white-oak-oyster-bar-and-cocktail-lounge-new-york
517,"[Category(name='Pubs', alias='pubs'), Category(name='Music Venues', alias='musicvenues'), Category(name='Irish Pub', alias='irish_pubs')]","(40.7416610717773, -73.978515625)",Paddy Reilly's Music Bar,4.0,71,"One of the most legendary establishments for music, community, and good-time fun in New York.

This place has a mystical quality that makes hours pass by...",paddy-reillys-music-bar-new-york
518,"[Category(name='Cocktail Bars', alias='cocktailbars'), Category(name='Beer Bar', alias='beerbar')]","(40.7224272551744, -73.9822487533092)",Corlear's,4.0,40,"We were here on a Saturday night after dinner, maybe around 9 or 10 pm. It's a very nicely decorated place on a quiet street. Strange part was... There was...",corlears-new-york-2
519,"[Category(name='Lounges', alias='lounges')]","(40.738437, -74.003425)",Art Bar,3.5,396,"First, you have to go into the back room to see why it's so awesome. Second, it's actually affordable ($8 meals, $6 beers).

The Back Room:
Picture...",art-bar-new-york
520,"[Category(name='Pubs', alias='pubs'), Category(name='German', alias='german'), Category(name='Austrian', alias='austrian')]","(40.7177673, -73.990589)",Cafe Katja,4.5,623,"this place was awesome, the waiters were extremely polite and explained in detail which plate was.  Beers are crisp and have all these cool German names, So...",cafe-katja-new-york
521,"[Category(name='Arcades', alias='arcades'), Category(name='Dive Bars', alias='divebars')]","(40.7206434531628, -73.9871944404755)",Two-Bit's Retro Arcade,4.0,183,"Randomly stumbled across this place after having brunch & dessert nearby at Freemans & Juicy Spot...we were just walking around the neighborhood, passed by...",two-bits-retro-arcade-new-york
522,"[Category(name='Breakfast & Brunch', alias='breakfast_brunch'), Category(name='Burgers', alias='burgers'), Category(name='Beer Bar', alias='beerbar')]","(40.7218285, -73.9866943)",Benson's NYC,4.5,178,What can I say that hasn't already been said by the many others who visited this wonderful getaway? I walked in and was greeted by Annie who is very kind...,bensons-nyc-new-york
523,"[Category(name='Party & Event Planning', alias='eventplanning'), Category(name='Bars', alias='bars')]","(40.7315814, -74.0017296)",Birthdays and Bottles,4.5,161,"I found the company thorough google search and decided to give them a try. 

Joshua responded quickly and read my requests carefully. I selected a few...",birthdays-and-bottles-new-york
524,"[Category(name='Gastropubs', alias='gastropubs'), Category(name='Italian', alias='italian'), Category(name='Wine Bars', alias='wine_bars')]","(40.7286329, -73.9998011)",Carroll Place,4.0,411,"I don't know how I only discovered this gem recently, but I've been missing out!  I came by Carroll Place with several other friends for happy hour on a...",carroll-place-new-york
525,"[Category(name='Restaurants', alias='restaurants'), Category(name='Wine Bars', alias='wine_bars')]","(40.743835, -73.996088)",Zagara Wine Bar & Ristorante,4.0,107,"I can't say enough good things about Zagara. I'm spoiled that I have such a great restaurant in my neighborhood. 
The staff is always friendly, everyone...",zagara-wine-bar-and-ristorante-new-york
526,"[Category(name='Breakfast & Brunch', alias='breakfast_brunch'), Category(name='Belgian', alias='belgian'), Category(name='Bars', alias='bars')]","(40.73865, -73.99451)",Petite Abeille,4.0,1042,Came at noon on a saturday for brunch. No reservations and the wait was about 30-40 minutes. The space isn't very big but very cozy. Love that there's...,petite-abeille-new-york-3
527,"[Category(name='Dive Bars', alias='divebars'), Category(name='Seafood', alias='seafood'), Category(name='Pubs', alias='pubs')]","(40.70766, -74.00205)",Jeremy's Ale House,4.0,220,#You can get the #styrofoam cups of beer here. Pretty cheap for the size. I miss big styrofoam cups of beer. More places should have them. I prefer not to...,jeremys-ale-house-new-york
528,"[Category(name='American (New)', alias='newamerican'), Category(name='Bars', alias='bars'), Category(name='Venues & Event Spaces', alias='venues')]","(40.749938, -73.985481)",The Liberty,3.5,248,"[drinks/service only review] 
What a nice find on a Sunday evening! We had been walking around for a while, just trying to find somewhere that had some type...",the-liberty-new-york-2
529,"[Category(name='Cocktail Bars', alias='cocktailbars'), Category(name='American (New)', alias='newamerican'), Category(name='Lounges', alias='lounges')]","(40.716834930598, -74.008267914206)",The Bennett,4.0,48,"I'm a fan of The Bennett. Brought to you by the group that runs Raines Law Room and Dear Irving, The Bennett ain't quite the same as those bars, but that's...",the-bennett-new-york-4
530,"[Category(name='Bars', alias='bars'), Category(name='American (Traditional)', alias='tradamerican')]","(40.7230272889137, -74.003147855401)",Broome Street Bar,3.5,178,I fell in love with this spot on the first try and all I did was grab a glass of wine.  The music playlist was awesome and it could of been the Whitney...,broome-street-bar-new-york-2
531,"[Category(name='Pubs', alias='pubs'), Category(name='Sports Bars', alias='sportsbars'), Category(name='American (New)', alias='newamerican')]","(40.742118, -74.00119)",Flight 151,3.5,194,"Flight 151 is one of my favorite bars in the city.  Super chill and always a good time. Casual atmosphere, kitschy airport-theme that doesn't go too far,...",flight-151-new-york
